,lines,name
1529,hiya that's a lot of money to be counting out in public, casino 
0,int tunnel day, chill factor 
1,come on night shift, chill factor 
2,int gomez's helicopter day, chill factor 
3,if we don't get out of this tunnel, chill factor 
4,that is going to explode, chill factor 
5,let me put it in easy terms aristotle we are carrying a damn bomb, chill factor 
6,int postal van day, chill factor 
7,it's a damn postal truck, chill factor 
8,int brynner's van day, chill factor 
9,shit, chill factor 
10,ext highway day, chill factor 
11,, chill factor 
12,int andy's ice cream factory andy's office day, chill factor 
13,, chill factor 
14,int andy's ice cream factory stairwell day, chill factor 
15,damn, chill factor 
16,ext ice cream truck day, chill factor 
17,unbe fucking lievable, chill factor 
18,ext road day, chill factor 
19,oh shit, chill factor 
20,ext road day, chill factor 
21,shit, chill factor 
22,oh, chill factor 
23,int ice cream truck cab dawn, chill factor 
24,, chill factor 
25,int ice cream truck cab dawn, chill factor 
26,help me get in the truck, chill factor 
27,ext motel night, chill factor 
28,, chill factor 
29,, chill factor 
30,int darlene's store night, chill factor 
31,at least somebody likes this shit, chill factor 
32,okay okay, chill factor 
33,what do you work for my boss dog, chill factor 
34,that's right, chill factor 
35,big balls, chill factor 
36,you see that was a that was my mission, chill factor 
37,yeah, chill factor 
38,uh he handled rackets and i carried the balls, chill factor 
39,, chill factor 
40,my code name was blackjack night shift was my coach uh uh uh i'm sorry mason was my coach, chill factor 
41,yeah, chill factor 
42,i was undercover as a tennis player, chill factor 
43,yeah, chill factor 
44,it all started with our mission in istanbul, chill factor 
45,yeah yeah yeah yeah, chill factor 
46,you know it's uh it's very hush hush as we say in the spy game, chill factor 
47,ooh, chill factor 
48,i feel faint, chill factor 
49,oh oh, chill factor 
50,oh, chill factor 
51,arlo nobody's gonna believe us, chill factor 
52,bullshit yeah well if we're not gonna be famous at least this'll be a great story to tell some ladies in a bar or somethin', chill factor 
53,that's bullshit, chill factor 
54,no, chill factor 
55,but he didn't see that's negotiation, chill factor 
56,us, chill factor 
57,look that's negotiating he threatened to kill, chill factor 
58,tiatin', chill factor 
59,i was not in the man's face i was nego, chill factor 
60,face crap you've been telling me, chill factor 
61,what about all that no need to get in the man's, chill factor 
62,thank you very much, chill factor 
63,thank you, chill factor 
64,yeah, chill factor 
65,i think so too, chill factor 
66,patriotism is its own reward, chill factor 
67,i'll handle this from here sweet owes us a little restitution, chill factor 
68,us owes us, chill factor 
69,i feel that my government owes me a little restitution, chill factor 
70,and and and truckless in the service of my country, chill factor 
71,right you damn skippy and now that i am both jobless, chill factor 
72,you, chill factor 
73,hello, chill factor 
74,you arlo, chill factor 
75,that army nut job to save your narrow butt, chill factor 
76,who put the big hurt on, chill factor 
77,who had to put a gun to your head, chill factor 
78,truck that kept elvis cool, chill factor 
79,who drove the ice cream, chill factor 
80,you did help a little, chill factor 
81,always the negative, chill factor 
82,excuse me i got a bullet in my leg, chill factor 
83,stop limpin' around like that, chill factor 
84,, chill factor 
85,hey hey hey hey hey we are heroes my man it's time to start actin' like it, chill factor 
86,they aren't exactly gonna publicize this arlo, chill factor 
87,we're the shit bigtime, chill factor 
88,, chill factor 
89,you know we saved half a million people from a full body peel, chill factor 
90,, chill factor 
91,well, chill factor 
92,elvis is still in there it's gonna go off, chill factor 
93,, chill factor 
94,, chill factor 
95,, chill factor 
96,, chill factor 
97,, chill factor 
98,why'd you stay behind, chill factor 
99,what'd you come back for, chill factor 
100,look out, chill factor 
101,, chill factor 
102,, chill factor 
103,okay come on big guy, chill factor 
104,they'll meet you at the top, chill factor 
105,arlo i'm gonna get elvis you go, chill factor 
106,got it come on darlin' i gotcha, chill factor 
107,go, chill factor 
108,let's go, chill factor 
109,hang on hang on, chill factor 
110,, chill factor 
111,sorry, chill factor 
112,, chill factor 
113,yeah yeah yeah, chill factor 
114,hold this, chill factor 
115,another way outta here hey, chill factor 
116,there's gotta be, chill factor 
117,well hell the smoke's gonna kill us anyway, chill factor 
118,can we get out on your end of the tunnel, chill factor 
119,, chill factor 
120,vitelli vitelli, chill factor 
121,ta get outta here, chill factor 
122,we got, chill factor 
123,, chill factor 
124,, chill factor 
125,, chill factor 
126,it's working, chill factor 
127,what, chill factor 
128,, chill factor 
129,what, chill factor 
130,, chill factor 
131,come on come on, chill factor 
132,, chill factor 
133,oh, chill factor 
134,, chill factor 
135,all right, chill factor 
136,, chill factor 
137,, chill factor 
138,it's melting man, chill factor 
139,what, chill factor 
140,mason, chill factor 
141,it says forty nine, chill factor 
142,forty nine point four, chill factor 
143,what's it say, chill factor 
144,shoot me, chill factor 
145,, chill factor 
146,unbe fucking lievable, chill factor 
147,i'm gonna kill him, chill factor 
148,stupid, chill factor 
149,you've gotta be, chill factor 
150,what the, chill factor 
151,what the hell, chill factor 
152,what do you think i'm doin', chill factor 
153,forty seven you'd better floor it, chill factor 
154,whoo, chill factor 
155,whoo, chill factor 
156,tunnel, chill factor 
157,tunnel, chill factor 
158,here comes the, chill factor 
159,okay, chill factor 
160,he's comin' up fast, chill factor 
161,our ass, chill factor 
162,and brynner's right on, chill factor 
163,they come, chill factor 
164,here, chill factor 
165,we've got elvis, chill factor 
166,i've got the real thing, chill factor 
167,we, chill factor 
168,okay, chill factor 
169,oh shit, chill factor 
170,forty five seven, chill factor 
171,oh fuck, chill factor 
172,okay okay, chill factor 
173,ful, chill factor 
174,aw shit would you be more care, chill factor 
175,, chill factor 
176,on, chill factor 
177,hang, chill factor 
178,, chill factor 
179,stop, chill factor 
180,, chill factor 
181,go, chill factor 
182,sometimes the prey bites back, chill factor 
183,you got elvis, chill factor 
184,what, chill factor 
185,to him, chill factor 
186,that's why i didn't give it, chill factor 
187,natic, chill factor 
188,, chill factor 
189,you just can't leave that stuff with that lu, chill factor 
190,, chill factor 
191,go go go, chill factor 
192,come here, chill factor 
193,, chill factor 
194,okay here we go, chill factor 
195,come on come on, chill factor 
196,, chill factor 
197,okay, chill factor 
198,, chill factor 
199,, chill factor 
200,i'm sorry i'm a little, chill factor 
201,, chill factor 
202,arlo, chill factor 
203,, chill factor 
204,okay, chill factor 
205,, chill factor 
206,all right okay, chill factor 
207,okay, chill factor 
208,, chill factor 
209,okay all right man okay, chill factor 
210,, chill factor 
211,okay, chill factor 
212,yeah, chill factor 
213,okay, chill factor 
214,oh, chill factor 
215,come on, chill factor 
216,, chill factor 
217,reach into my pocket, chill factor 
218,arlo arlo, chill factor 
219,we're gonna die and you want me to do some freaky shit like that, chill factor 
220,, chill factor 
221,what, chill factor 
222,put your hand in my pants, chill factor 
223,, chill factor 
224,hey hey hey, chill factor 
225,we're gonna die, chill factor 
226,we're gonna die, chill factor 
227,, chill factor 
228,arlo shut up, chill factor 
229,we're gonna die, chill factor 
230,hey just shut up, chill factor 
231,, chill factor 
232,they're movin', chill factor 
233,huh, chill factor 
234,they're takin' off, chill factor 
235,hey, chill factor 
236,, chill factor 
237,listen arlo, chill factor 
238,no, chill factor 
239,are you all right, chill factor 
240,, chill factor 
241,, chill factor 
242,ow, chill factor 
243,, chill factor 
244,bullshit you would've killed us anyway, chill factor 
245,you all right, chill factor 
246,, chill factor 
247,bring him down, chill factor 
248,, chill factor 
249,yeah i know i know, chill factor 
250,man, chill factor 
251,a and you owe me, chill factor 
252,or my conscience, chill factor 
253,squirm i don't want his brains all over my shirt, chill factor 
254,even though it is nice to see andy, chill factor 
255,deal with this asshole, chill factor 
256,i think you oughta cut a, chill factor 
257,yeah, chill factor 
258,hey mason, chill factor 
259,all right all right hey hey, chill factor 
260,yeah baby, chill factor 
261,whoo, chill factor 
262,that is loud i'm, chill factor 
263,, chill factor 
264,like i said i got a pretty good idea of what's at stake here, chill factor 
265,, chill factor 
266,miles, chill factor 
267,split i wouldn't get ten, chill factor 
268,split, chill factor 
269,well all the same if we get to missoula help me find a car i'd appreciate it then you can, chill factor 
270,shit, chill factor 
271,long somethin' about that look in his eye when he talked about that elvis, chill factor 
272,er it was your friend, chill factor 
273,loaded i didn't buy you as a shoot, chill factor 
274,i mean if that gun was, chill factor 
275,not completely anyway, chill factor 
276,to tell you the truth you didn't, chill factor 
277,shit, chill factor 
278,for whatever it's worth i'm sorry i dragged you into this, chill factor 
279,listen arlo, chill factor 
280,, chill factor 
281,we got two paddles, chill factor 
282,well shit could be worse i mean we're both up shit's creek but at least we have a paddle, chill factor 
283,anyway about ten months ago i wound up in jerome workin' for darlene, chill factor 
284,and things sort of just went downhill from there, chill factor 
285,couldn't deal with it so i split, chill factor 
286,never gonna throw a ball in the pros, chill factor 
287,hospital, chill factor 
288,and i put the car into a ditch he spent eighteen weeks in the, chill factor 
289,we were celebrating right after the draft going from bar to bar i was drivin', chill factor 
290,i remember him got in a car crash or somethin', chill factor 
291,yeah robert del rio, chill factor 
292,robert del rio, chill factor 
293,started every game my senior year not all american or anything but not bad anyway the real star was my best friend the quarterback got taken in the first round, chill factor 
294,how wonderful for you, chill factor 
295,we were nationally ranked, chill factor 
296,you know four years ago i was a split end at kentucky state, chill factor 
297,you know, chill factor 
298,yeah, chill factor 
299,so i took his truck yeah, chill factor 
300,truck, chill factor 
301,so you took his, chill factor 
302,nobody's lookin' out for my interests my credit was fucked and then when he promoted sam over me i just snapped so i split, chill factor 
303,overdrawn bank accounts, chill factor 
304,just ready to just slide him right in there and what about me huh what about arlo huh what about my needs you know i got a i got student loans, chill factor 
305,or nephew or some good old boy, chill factor 
306,there'd be a sales rep desk with my name on it but every time something opened up there'd be some idiot cousin, chill factor 
307,and he swore he swore once i got a degree, chill factor 
308,i deserve a lot more than that truck ten years ten years i busted my ass for that fat rat bastard, chill factor 
309,you know what i'm sayin', chill factor 
310,it won't even start half the time, chill factor 
311,piece of shit was worth, chill factor 
312,hey i told you i did not steal that truck andy owes me a lot more than that four wheeled, chill factor 
313,stole the truck, chill factor 
314,hey i didn't steal the truck you, chill factor 
315,tion, chill factor 
316,see now why would you do that to a man in my posi, chill factor 
317,you're fucked man, chill factor 
318,did you, chill factor 
319,hey you didn't happen to lock the truck up when you got out, chill factor 
320,, chill factor 
321,worth a try, chill factor 
322,okay, chill factor 
323,this river's fed by a glacier willing to bet my life that it's a good deal under fifty degrees, chill factor 
324,this thing just went up a degree ice cream's not workin', chill factor 
325,what, chill factor 
326,uh oh, chill factor 
327,whoo hoo hoo, chill factor 
328,, chill factor 
329,, chill factor 
330,, chill factor 
331,, chill factor 
332,all right hey, chill factor 
333,, chill factor 
334,, chill factor 
335,, chill factor 
336,oh no, chill factor 
337,oh no, chill factor 
338,no, chill factor 
339,oh shit, chill factor 
340,, chill factor 
341,, chill factor 
342,okay okay, chill factor 
343,keep still, chill factor 
344,, chill factor 
345,, chill factor 
346,oh shit, chill factor 
347,come on, chill factor 
348,what, chill factor 
349,i don't want you to come anyway, chill factor 
350,oh shit okay come on, chill factor 
351,here, chill factor 
352,then stay, chill factor 
353,you're not dangerous you're crazy i ain't gettin' in this damn thing, chill factor 
354,, chill factor 
355,you're what, chill factor 
356,taking it down the hill, chill factor 
357,, chill factor 
358,i'm crazy, chill factor 
359,he's crazy, chill factor 
360,man, chill factor 
361,yeah he's a dangerous, chill factor 
362,i'm a dangerous man, chill factor 
363,you're dealin' with, chill factor 
364,to him you don't know who, chill factor 
365,listen listen, chill factor 
366,hey put it back we're takin' off, chill factor 
367,, chill factor 
368,okay all right okay, chill factor 
369,, chill factor 
370,all right let's go, chill factor 
371,, chill factor 
372,aw shit, chill factor 
373,yeah, chill factor 
374,yeah, chill factor 
375,these'll keep it cold, chill factor 
376,okay okay, chill factor 
377,gimme that gimme that gimme that, chill factor 
378,all right, chill factor 
379,okay, chill factor 
380,all right, chill factor 
381,okay, chill factor 
382,, chill factor 
383,oh shit it's okay okay, chill factor 
384,oh shit oh shit, chill factor 
385,come on, chill factor 
386,no shit, chill factor 
387,, chill factor 
388,oh pete oh shit oh shit, chill factor 
389,, chill factor 
390,, chill factor 
391,go go, chill factor 
392,go on, chill factor 
393,shit, chill factor 
394,, chill factor 
395,, chill factor 
396,, chill factor 
397,hey, chill factor 
398,hang on, chill factor 
399,, chill factor 
400,, chill factor 
401,shit, chill factor 
402,ho, chill factor 
403,oh, chill factor 
404,ho ho, chill factor 
405,, chill factor 
406,shut up, chill factor 
407,gee you think so, chill factor 
408,okay that didn't work, chill factor 
409,holy, chill factor 
410,gee you think so, chill factor 
411,shit you gotta pass him, chill factor 
412,what the fuck was that, chill factor 
413,you okay, chill factor 
414,what are you talkin' about i'm the one drivin', chill factor 
415,i made it, chill factor 
416,i made it, chill factor 
417,whoo, chill factor 
418,whoo, chill factor 
419,all right you got it you got it, chill factor 
420,you crazy bastard, chill factor 
421,come on, chill factor 
422,come on, chill factor 
423,come on, chill factor 
424,, chill factor 
425,pete come on, chill factor 
426,come on old, chill factor 
427,wanna give it a try, chill factor 
428,night shift but you might, chill factor 
429,hood of you knowin' any prayers is slim, chill factor 
430,i know the likeli, chill factor 
431,come on old pete oh, chill factor 
432,pete come on, chill factor 
433,oh shit come on old, chill factor 
434,come on, chill factor 
435,get over get over, chill factor 
436,left left left, chill factor 
437,easy easy easy, chill factor 
438,oh, chill factor 
439,i'm goin' i'm goin' baby i'm goin' i'm goin', chill factor 
440,god man, chill factor 
441,come on old pete, chill factor 
442,come on, chill factor 
443,come on old pete, chill factor 
444,oh shit, chill factor 
445,go go go go go oh shit, chill factor 
446,hey hey whoo okay, chill factor 
447,i should've had that dog bite me i would've gotten rabies could've went to the hospital had a pretty nurse, chill factor 
448,oh petey oh petey oh please pete please don't do this to me okay, chill factor 
449,goddamn, chill factor 
450,, chill factor 
451,okay, chill factor 
452,okay, chill factor 
453,oh shit, chill factor 
454,, chill factor 
455,, chill factor 
456,that's right now move, chill factor 
457,oh shit, chill factor 
458,do we, chill factor 
459,i don't think we have much of a choice, chill factor 
460,your weedkiller on steroids goes down with us everybody dies, chill factor 
461,, chill factor 
462,hey and what if we don't make it, chill factor 
463,eight and a half feet wide weighs over five tons, chill factor 
464,you think we can make what you see that truck, chill factor 
465,we can make it, chill factor 
466,i think, chill factor 
467,you can just bend over and kiss your crazy ass goodbye buddy, chill factor 
468,shift, chill factor 
469,oh we're screwed night, chill factor 
470,oh shit, chill factor 
471,, chill factor 
472,fuck, chill factor 
473,all right you got it, chill factor 
474,is old pete come on baby, chill factor 
475,pete come on there it, chill factor 
476,come on old, chill factor 
477,, chill factor 
478,up, chill factor 
479,back up back, chill factor 
480,oh shit, chill factor 
481,man, chill factor 
482,holy shit, chill factor 
483,oh, chill factor 
484,, chill factor 
485,, chill factor 
486,hey hey andy's ice cream, chill factor 
487,you snatch that phone from me one more time i'm, chill factor 
488,waiting, chill factor 
489,well then that means it's call, chill factor 
490,shut up shut up it's beeping, chill factor 
491,truck, chill factor 
492,it was owed to me you stole the damn, chill factor 
493,, chill factor 
494,i did not steal the truck, chill factor 
495,you stole the truck to uphold your principles right, chill factor 
496,let live, chill factor 
497,yeah, chill factor 
498,i believe in live and, chill factor 
499,and i'm a peaceful man and, chill factor 
500,you wanna hit me, chill factor 
501,you, chill factor 
502,every time i look at you i wanna hit, chill factor 
503,hi the gun was empty, chill factor 
504,er, chill factor 
505,cho and a hijack, chill factor 
506,reconsider that statement there night shift you're psy, chill factor 
507,hey take a look at your situation and, chill factor 
508,i'm not the psycho, chill factor 
509,no, chill factor 
510,probably because they know a psycho when they hear one, chill factor 
511,, chill factor 
512,kiss my ass, chill factor 
513,i was thankin' you asshole, chill factor 
514,gun, chill factor 
515,don't gimme that nice job shit man they still got a vanload comin' and what do you got besides an empty, chill factor 
516,, chill factor 
517,nice job back there, chill factor 
518,okay, chill factor 
519,elvis is on ice again, chill factor 
520,, chill factor 
521,okay all right, chill factor 
522,all right, chill factor 
523,get him to stand up night shift, chill factor 
524,oh, chill factor 
525,, chill factor 
526,, chill factor 
527,, chill factor 
528,, chill factor 
529,oh shit, chill factor 
530,you mean to tell me you hijacked me with an empty gun, chill factor 
531,ed, chill factor 
532,work it's not even load, chill factor 
533,doesn't, chill factor 
534,what, chill factor 
535,doesn't work, chill factor 
536,take your gun, chill factor 
537,, chill factor 
538,shut up, chill factor 
539,you're nuts goin' back there, chill factor 
540,, chill factor 
541,, chill factor 
542,, chill factor 
543,, chill factor 
544,okay, chill factor 
545,no no no no no keep goin', chill factor 
546,ah one of them's in the back, chill factor 
547,okay okay, chill factor 
548,damn, chill factor 
549,god, chill factor 
550,, chill factor 
551,fine, chill factor 
552,we can't push old pete in this heat he can't take it, chill factor 
553,hey, chill factor 
554,, chill factor 
555,shut up, chill factor 
556,i ain't playin' that, chill factor 
557,fine, chill factor 
558,that's, chill factor 
559,i'm about to get in your ass like last year's underwear man, chill factor 
560,look i don't give a shit if you go through missoula at a hundred miles an hour we're goin' to mcgruder, chill factor 
561,i didn't steal the truck he owed it to me anyway the important thing is i'm not goin' through missoula, chill factor 
562,the ice cream for money, chill factor 
563,what all the bullshit about the cash was wasn't it you stole this truck and now you're trying to sell, chill factor 
564,you stole this truck that's, chill factor 
565,i did not steal this truck, chill factor 
566,you stole this truck, chill factor 
567,you stole this truck, chill factor 
568,yeah borrowed, chill factor 
569,borrowed, chill factor 
570,look i kinda borrowed the truck from andy, chill factor 
571,am i missing somethin' here, chill factor 
572,i ain't goin' through missoula, chill factor 
573,er, chill factor 
574,no way we're goin' through mcgrud, chill factor 
575,to get to mcgruder you have to go through missoula and i ain't goin' to missoula, chill factor 
576,no no no, chill factor 
577,no no no no no we gotta go to mcgruder i go where the truck goes, chill factor 
578,er, chill factor 
579,no you gotta go to mcgrud, chill factor 
580,billings no no no no no we need to go to mcgruder, chill factor 
581,suppose you're gonna shoot me because you can't get service on my cell phone, chill factor 
582,no cell, chill factor 
583,oh man, chill factor 
584,we're clear, chill factor 
585,, chill factor 
586,town, chill factor 
587,you'd better coast through, chill factor 
588,, chill factor 
589,do you wanna give me a minute, chill factor 
590,excuse me can you fix this, chill factor 
591,ed, chill factor 
592,excuse me, chill factor 
593,damn diesel injections are flood, chill factor 
594,all the time, chill factor 
595,it happens to this piece of shit, chill factor 
596,what the hell's goin' on, chill factor 
597,damn, chill factor 
598,come on, chill factor 
599,, chill factor 
600,are you kiddin', chill factor 
601,up, chill factor 
602,shut, chill factor 
603,i'm gonna bust a mudhole in your ass i'm gonna don't tell me to shut it's none of your business man i can talk all i want to, chill factor 
604,come on get in the truck, chill factor 
605,i'm gonna stomp your a, chill factor 
606,that dog ain't mean, chill factor 
607,that dog was mean before i met him, chill factor 
608,what did you do that for it makes him mean as a snake, chill factor 
609,yeah to keep him off my ass, chill factor 
610,you gave him ice cream didn't you come on let's go, chill factor 
611,what the hell is with you dog he's the one with the damn gun, chill factor 
612,there we go there we go did you keep it safe did you, chill factor 
613,, chill factor 
614,look put this in the back keep it safe, chill factor 
615,would you hurry up please, chill factor 
616,go on, chill factor 
617,you are not takin' my truck, chill factor 
618,i need your truck, chill factor 
619,doing, chill factor 
620,hey you're gonna piss me what the hell are you supposed to be, chill factor 
621,all right then how about this, chill factor 
622,no, chill factor 
623,i'll rent the truck from you you can stay here you can go whatever you want, chill factor 
624,i got fifty bucks i'll get more, chill factor 
625,i got uh, chill factor 
626,i got like uh, chill factor 
627,you want cash, chill factor 
628,you want cash, chill factor 
629,wait wait wait hold up hold up look, chill factor 
630,, chill factor 
631,all right, chill factor 
632,peace, chill factor 
633,is as dangerous as you seem to think it is i'm gettin' my ass as far away from you and it as possible, chill factor 
634,and if that elvis shit, chill factor 
635,look i got two tons of the world's nastiest ice cream sittin' in a truck that should've been retired ten years ago that shit will be worthless by noon, chill factor 
636,er, chill factor 
637,then you drive me to mcgrud, chill factor 
638,truck, chill factor 
639,you are seriously mistaken if you think you are going anywhere in my, chill factor 
640,i need your help, chill factor 
641,o of all wantin' to be a part of this wacko shit, chill factor 
642,think he was a wacko and i think that g i ninja's a bigger wacko and i think you're the biggest wack, chill factor 
643,hey listen do you know what i think i, chill factor 
644,for cryin' out loud, chill factor 
645,yeah i believe him he was my friend, chill factor 
646,ya, chill factor 
647,wait wait you don't believe the dead guy do, chill factor 
648,tana, chill factor 
649,look if i don't get this stuff to mcgruder it's goodbye andy's ice cream goodbye jerome goodbye mon, chill factor 
650,and a shitload of ice, chill factor 
