,lines,name
0,now instead of the cops only lookin' at nicky they started looking at green too and he was supposed to be our squeaky, casino 
1,i'm a little in shock quite frankly, casino 
2,why are you doing this to me, casino 
3,it turned out phil green mr integrity had a partner nobody knew about and when she showed up and started demanding some money from the tangiers, casino 
4,i can't believe you're doing this, casino 
5,was gonna stop what came up next at the casino, casino 
6,it's like everything else in this place you don't do it yourself it never gets done, casino 
7,what are you talking about, casino 
8,look at that look at this there's nothin' look how many blueberries your muffin has and how many mine has yours is falling apart i have nothing, casino 
9,what, casino 
10,look at yours, casino 
11,phil i can understand you're in the finances you're upstairs but you are not on the floor i got thousands of players i got five hundred dealers they're all lookin' to rob me blind twenty four hours a day i have to let them know i'm watching all the details all the time that there is not one single thing i will not catch as i am over here, casino 
12,this is his state his uncle's chief judge his brother in law runs the county commission i don't know how many other relatives he's got in town there's gotta be a way to work him back in, casino 
13,so what everybody out here with cowboy boots is a fuckin' county commissioner or related to a county commissioner i'm fuckin' sick of it, casino 
14,but you can't just fire him webb's his brother in law he's county commissioner, casino 
15,i mean the guy is history as far as i'm concerned history, casino 
16,he did what he was told, casino 
17,thank you, casino 
18,yes you were, casino 
19,you know damn well i was at that dinner and you swore to me that i would have a fair hearing at that dinner did you not did you not well tell me i was at least at the dinner a allow me that much give me that much at least, casino 
20,i was in the building, casino 
21,you were in the m you were in the building, casino 
22,was i at that dinner, casino 
23,you were wandering around, casino 
24,was i at that dinner, casino 
25,you were wandering around, casino 
26,was i at that dinner, casino 
27,you were wandering around, casino 
28,was i at that dinner just tell me, casino 
29,the only time i was at the tangiers was when i had dinner with barney greenstein, casino 
30,he's lying, casino 
31,mr rothstein is being very typical to this point, casino 
32,liar, casino 
33,uh i i'd i'd like to answer answer that at this time, casino 
34,i never comped you i don't comp you at least two or three times a month at the tangiers, casino 
35,that's right, casino 
36,you were never my guest, casino 
37,i was never i was never your guest at the tangiers, casino 
38,good to see ya william would you, casino 
39,hey i need a room need a room, casino 
40,hello senator, casino 
41,hi ace, casino 
42,i can't do that, casino 
43,i would forget about the maneuver i would just get out, casino 
44,all right look if he took a break it would just give everybody some time to maneuver that's all i'm saying it's all that i'm saying, casino 
45,they ain't sendin' nicky nowhere, casino 
46,i don't know he doesn't listen to me maybe he should get lost for a while take a vacation would that be so bad, casino 
47,what do you propose, casino 
48,know what my problem is every time they mention my name in the papers these cocksuckers they mention nicky too how the fuck does that help i mean the heat he brought down is murder we had a police department who was cooperative he's pissed them off so much now that nobody can make a move anymore i mean what do you do about that, casino 
49,the old man said 'maybe your friend should give in ' and when the old man says 'maybe' that's like a papal bull not only should you quit you should run, casino 
50,walk away andy you can't be serious how can i walk away don't you see what's goin' on here don't you see what's at stake, casino 
51,these guys back home don't give a fuck about the supreme court and any of this bullshit they want things to quiet down they want you to walk away from, casino 
52,first of all what they did was totally unconstitutional we're already on the list to be heard before the supreme court of the united states later this year, casino 
53,it's a pity in this, casino 
54,he's on all night screamin' about how he's gonna take his damn lawsuit all the way to the supreme court he really must be crazy he's gonna go to washington with this he's out of his fuckin' mind, casino 
55,nobody's gonna interfere with your running the casino i guarantee it, casino 
56,i'm serious no interference, casino 
57,you got it, casino 
58,it's a tough proposition andy you you know if i did it i'd have to run it my way, casino 
59,why would they want to find out we're puttin' a hundred million into this desert here why would they want to lock us out and besides they'll never find out all you gotta do is keep changing your job title like uh from casino executive to food and beverage chairman and what happens it they take your application they put it at the bottom of the pile i know guys workin' there for thirty years don't have a license, casino 
60,but what happens when they do find out, casino 
61,you don't have to have a license to work in a casino all you gotta do is apply for one the state law says you can work in a casino while they're processing your application they got a ten year backlog, casino 
62,this check for 62 700 000 for the new tangiers, casino 
63,but andy also took orders and when he was told to give a pension fund loan to philip green, casino 
64,on behalf of the teamsters' pension fund it is my pleasure to present to you, casino 
65,he even played golf with the president, casino 
66,philip if you would rise, casino 
67,a powerful man, casino 
68,this is a very auspicious occasion, casino 
69,as far as the world was concerned andy stone the head of the teamsters' pension fund was a legitimate guy, casino 
70,speeding, casino 
71,look look you can't stop her for speeding i mean look what the hell she's doing, casino 
72,hold on a second, casino 
73,hey, casino 
74,wait hold on a second, casino 
75,stop, casino 
76,all right take care, casino 
77,okay randy thank you, casino 
78,congratulations, casino 
79,yeah, casino 
80,oh good, casino 
81,not bad not bad in fact uh my wife's pregnant again, casino 
82,fine fine how's your family, casino 
83,no it's it'll just be a couple of minutes we got other things to do too you know he'll hurry her up how's everything else besides this, casino 
84,yeah i don't want her in there more than a few more minutes, casino 
85,i will let her in the house for five minutes if you gentlemen will escort her out if she happens not to want to leave because i don't i, casino 
86,no you're not calm, casino 
87,jesus christ what gun he's got a fuckin' hero sandwich here, casino 
88,been right but who knows, casino 
89,the worst was blue, casino 
90,watch it partner watch it, casino 
91,stupid things, casino 
92,i mean frank marino was there to meet him but so were the cops this time they wanted to pinch him for some diamond burglary in antwerp, casino 
93,excuse me, casino 
94,even after a little vacation they hassled him at the airport, casino 
95,you got it schmuck all right i just bought us a few minutes want to get back at this prick, casino 
96,right back, casino 
97,i'll call you right back, casino 
98,right away, casino 
99,mm hm 1862 okay good i'll call you right b, casino 
100,702 472 1862, casino 
101,so l l l listen i te i te i tell you can i call you back in a few minutes, casino 
102,sam i i don't know where she is okay, casino 
103,you understand put her on the fuckin' phone, casino 
104,uh i'm not sam i wouldn't, casino 
105,i know she's there don't fuck around with me, casino 
106,listen to me very carefully i want to talk to ginger i want my kid back i want her put on a plane immediately, casino 
107,lester, casino 
108,she's not here sam, casino 
109,rothstein i want to talk to ginger put her on the phone, casino 
110,yeah is this lester this is sam, casino 
111,hello, casino 
112,hello, casino 
113,hey little dale evans, casino 
114,m uh mr and mrs rothstein, casino 
115,hey that's just fuckin' that's bullshit you know you know what the fuck, casino 
116,you fuckin' piece of shit, casino 
117,okay, casino 
118,you do yeah well if you ever come back again ever to take her money next time bring a pistol that way you got a chance be a man don't be a fuckin' pimp now you want to do me a favor get out of here i want to be alone with my wife get the fuck up and get out of here, casino 
119,yeah yeah i know that, casino 
120,she's my wife look at me you did know that didn't you you knew that she's my wife huh hey look at me, casino 
121,he was a moocher a card cheat a country club golf hustler a scumbag chasing dentists for a few bucks, casino 
122,yeah, casino 
123,look gin you know i got other people in this i got partners but i want you to understand that i am lookin' out for you in this thing okay you're going to get yours back and you're gonna get it back first okay, casino 
124,but one thing i could never understand was that she could have everything under control except for her old pimp boyfriend lester diamond, casino 
125,well, casino 
126,no tha that's good it's just unusual to tell you the truth so many of my clients don't, casino 
127,yeah sure i do why, casino 
128,sam let me ask you a question you must really trust your wife, casino 
129,that's right, casino 
130,so once she signs those papers she'll be the only person to have total access to the box no one else including myself, casino 
131,now this is just a signature card, casino 
132,ohhh, casino 
133,i don't know, casino 
134,you don't know what time did your mother do this when did she leave, casino 
135,i don't know, casino 
136,when did this happen honey, casino 
137,oh no please please, casino 
138,i'm gonna get a knife and cut you loose honey i'll, casino 
139,mommy, casino 
140,what happened what happened who did this to you, casino 
141,dad, casino 
142,wh wh, casino 
143,i can't i'm tied, casino 
144,amy amy open the door, casino 
145,help daddy, casino 
146,hello hello ginger, casino 
147,okay, casino 
148,oh have a good day at school, casino 
149,hey be fuckin' nice calm be nice don't fuck up in here, casino 
150,yeah nicky i want to talk to that fuckin' bitch, casino 
151,she didn't know who to turn to she she didn't know where to turn she was tryin' to save your marriage, casino 
152,i want to just talk i want to talk to that irish bitch, casino 
153,ace don't listen don't don't make a scene all right, casino 
154,i'll be right there, casino 
155,yeah she's here, casino 
156,she's there with you she's there with you, casino 
157,yeah well listen ginger's over here at the leaning tower with me, casino 
158,ginger's missing and she tied amy up and she locked her in her room i gotta find her i don't know where the hell she is, casino 
159,well, casino 
160,uh you know i just wanted to talk to you a minute, casino 
161,well, casino 
162,how'd you know i was here, casino 
163,no i'm not okay, casino 
164,yeah what are you doin' you okay, casino 
165,nick, casino 
166,it's me, casino 
167,yeah uh who's this, casino 
168,sammy, casino 
169,hello, casino 
170,well once you get her here you think about it you know but get the kid back here she wants to come back that's the uh that's the main thing here you want your kid don't you huh, casino 
171,she's driving me fuckin' crazy, casino 
172,i think if you uh okay it you know assure her that she's gonna be all right she'll come back, casino 
173,i don't know what am i gonna do with this woman i don't know she's drivin' me fuckin' crazy, casino 
174,i know why didn't you come to me i mean this is family it ain't business meanwhile you make calls back home sammy it makes us look bad out here you know what i mean back and forth this one and that one and in the meantime she's gone anyway am i right, casino 
175,yeah she's with that cocksucker again and they got amy, casino 
176,she was afraid to call you, casino 
177,and what'd she want, casino 
178,i just told you she called me, casino 
179,yeah, casino 
180,ginger called me, casino 
181,i'm gonna okay you ten and get you even and that's it then you got to get out of here before the cops and the newspapers are all over you, casino 
182,just give me the money fuckin' give me the fuckin' money sammy, casino 
183,nicky nicky you're not listenin' to me i'm here to help you what's the matter with you you're gonna bury us both, casino 
184,hey sammy tell this jew motherfucker over here to pay that marker, casino 
185,what are you doin' you gotta get out of here, casino 
186,get this through your head you jew motherfucker you you only exist out here because of me that's the only reason without me you personally every fuckin' wiseguy skell skell the lowest form of wiseguy a drunken bum around'll take a piece of your fuckin' jew ass then where you gonna go you're fuckin' warned don't ever go over my fuckin' head again you motherfucker you, casino 
187,you never, casino 
188,back back up back up a fuckin' minute here one minute i asked you when the fuck did i ever ask you if i could come out here get this through your head you, casino 
189,you do you remember what i told you, casino 
190,back, casino 
191,no it it nicky when you asked me if you could come out here what did i tell you i mean you asked me and i knew you were going to come out no matter what i said but what did i tell you do you remember what i told, casino 
192,oh sure now you want to blame your fuckin' license on me is that it, casino 
193,me i wouldn't even be in this situation if it wasn't for you you brought down so much fuckin' heat on me i mean every time i meet somebody here the big question is do i know you, casino 
194,you're makin' a big fuckin' spectacle of yourself, casino 
195,yeah i did want to go on tv that way i have a forum i can fight back i'm known people see me they know they can't fuck around with me like they could if i was an unknown that's right, casino 
196,your fuckin' ass you could have had the food and beverage job without goin' on television you wanted to go on tv, casino 
197,i'm only on tv because i gotta be able to hang around the casino you understand that you know that come on, casino 
198,you know i get calls from back home every fuckin' day they think you went batshit, casino 
199,what are you, casino 
200,i'm what counts out here not your fuckin' country clubs or your fuckin' tv shows and what the fuck are you doin' on tv anyhow, casino 
201,i, casino 
202,oh i don't know whether you know this or not but you only have your fuckin' casino because i made that possible, casino 
203,yeah i said i let the bullshit blow over for a while so i can run the casino anything goes wrong with the casino it's my ass it's not yours it's my ass, casino 
204,you want me to get out of my own fuckin' town, casino 
205,i didn't do anything i mean i didn't order you or anybody i only told andy stone that you had a lot of heat on you and that was a problem, casino 
206,no you said i'm bringin' heat on you i gotta listen to people because of your fuckin' shit you're ordering me out you better get your own fuckin' army pal, casino 
207,i don't even know what you're talkin' about nick, casino 
208,what people what'd you think i wasn't gonna find out, casino 
209,what people, casino 
210,where the fuck you get off talkin' to people about me behind my back goin' over my head, casino 
211,don't ask questions just be there, casino 
212,why, casino 
213,hundred yards further down the road, casino 
214,no a, casino 
215,what what caesar's, casino 
216,meet me at three, casino 
217,yeah, casino 
218,and at the, casino 
219,practice enough this week you prick, casino 
220,on the line and this guy's out havin' the time of his life he has every cop in the state watchin' him and he's out playin' golf, casino 
221,the problem was nicky was not only bringin' heat on himself but on me too the fbi watched every move he made but he didn't care he just didn't care, casino 
222,i see you you motherfuckers, casino 
223,peekaboo you fucks you, casino 
224,the coppers blamed me for everything that went wrong out here and i mean every little fuckin' thing too, casino 
225,nicky was questioned in two dozen murders but they always had to let him go there were never any witnesses, casino 
226,nicky wanted to take over he wanted to go after gaggi go after the skim go after everything and everybody, casino 
227,fuckin' walking around with a big head you better check yourself, casino 
228,i knew what he wanted and i didn't want any part of it, casino 
229,your fuckin' head is getting' bigger than your casino that's your problem pal, casino 
230,this guy is gonna run to the fbi, casino 
231,yeah that's right the way you need me to vouch for you as a citizen and get you out of one of your jams i'm gonna have to straighten out what you just did with this guy, casino 
232,a week ago it was my business now it's none of my business in other words when you need me to take care of somethin' for you then you need me, casino 
233,that's right yeah, casino 
234,it's none of my business, casino 
235,ju just stay away from her it's none of your business okay there are certain things you don't do and you know that, casino 
236,and i what was i supposed to do throw her out, casino 
237,okay, casino 
238,she came to talk to me, casino 
239,don't do it to me, casino 
240,to me, casino 
241,please, casino 
242,hey she came to talk, casino 
243,i i would appreciate it if you'd stay out of my personal life okay you wouldn't like it if i did it to you, casino 
244,the point is that she's upset she's and you got a fuckin' problem, casino 
245,listen i would, casino 
246,no i didn't what good would that do that's not the fuckin' point, casino 
247,all of a sudden you're the shoulder to cry on did you at least tell her about your little role in that whole situation, casino 
248,well she comes to see me she was upset about a lot of things especially that whole fuckin' diamond that lester diamond incident, casino 
249,now what does she have to do with all this, casino 
250,yeah, casino 
251,my wife, casino 
252,you know i didn't want to bring this up but you have treating a lot of people with a lot of disrespect even your own wife, casino 
253,yeah, casino 
254,uh uh cigarette holder i'm i lost control, casino 
255,all right, casino 
256,a fuckin' pink robe and a fuckin', casino 
257,all right, casino 
258,look at you you're fuckin' walkin' around like john barrymore, casino 
259,yes you lost your control, casino 
260,i lost control, casino 
261,you lost your control, casino 
262,yeah, casino 
263,what happened to me what happened to you, casino 
264,what the fuck happened to you will you tell me, casino 
265,every time you're on television i get mentioned that looks bad that looks bad, casino 
266,yeah, casino 
267,looks bad i'm gonna tell you what looks bad, casino 
268,well back home they don't know about fuckin' control that looks bad, casino 
269,i have no control over that ronnie and billy were right there they'll tell you exactly what happened, casino 
270,yeah that's out of context okay, casino 
271,that's all taken out of context okay, casino 
272,you mean quiet like this 'i'm the boss ' that's quiet, casino 
273,okay i just wanna run a square joint that's it i just want my license i want everything nice and quiet that's it, casino 
274,fine, casino 
275,i don't wanna be involved in anything you're talkin' about, casino 
276,all right fine, casino 
277,i'll be honest with you, casino 
278,just say so, casino 
279,i don't wanna come along with you, casino 
280,you should say so, casino 
281,no i don't wanna come, casino 
282,yeah forget about your fuckin' license i plant my own flag out here you ain't gonna need a fuckin' license you know i don't know what it is sammy but the more i talk to you the more i feel like you just don't wanna go along with me is that it, casino 
283,listen nick you gotta understand my situation i'm responsible for thousands of people i got a hundred million a year goin' through the place it's all over i'm gonna tell you it's all over if i don't get that license and believe me if it goes bad for me it's gonna go bad for a lot of people you understand, casino 
284,where's my head where's your fuckin' balls huh you know i'm tryin' to put somethin' really big together out here you know what i'm talkin' about huh you know if you're actin' like this now how can i depend on you there's a lot of things gonna change out here and if you wanna be there with me sammy you're gonna have to go my fuckin' way, casino 
285,i'm not tryin' to tell you what to do but you were way out of line nick what're you doin' where's your head, casino 
286,fuck the fbi that prick's been dodging me for three weeks and what is it with you all of a sudden you're tryin' to tell me what to do all the time, casino 
287,what're you doin' he's a square guy for chrissakes you can't treat him like that he's gonna run to the fbi, casino 
288,you think he got the point, casino 
289,hey, casino 
290,hey ace, casino 
291,well it's okay i'll use the service entrance i'll see you at nine, casino 
292,very difficult to get in, casino 
293,it's impossible it's booked up and you gotta make a reservation it's, casino 
294,no no it's okay, casino 
295,listen, casino 
296,hello, casino 
297,here let's put a little of this on for you i know you like this a little butter right not a lot, casino 
298,no matter where he was or what he was doing he always went home to make breakfast for his son nicky boy, casino 
299,hey rich, casino 
300,yeah nicky loved restaurants he was a real restaurant buff and over the years he always made money with them, casino 
301,i gotta do somethin' i gotta do somethin' they ain't gettin' rid of me they're not gettin' rid of me i'm staying here fuck 'em fuck 'em, casino 
302,it just didn't sink into his head about the black book and what it meant not being able to go into a casino is just one thing but being in this book etched your name into the brains of every cop and fbi agent in the state i mean you're listed in there with al capone but nicky didn't care, casino 
303,in so many words yes, casino 
304,in other words i'm fucked, casino 
305,forget it you can't even set foot in the parking lot that's how serious it is, casino 
306,let's say for instance i want to go in the restaurant which happens to be in the casino to get one of those sandwiches i like, casino 
307,nope there's no way, casino 
308,motherfucker unsavory fuckin' is there any way around this, casino 
309,yeah i believe it you got banned, casino 
310,' detrimental to gaming and he will be ejected from any casino in las vegas and the casinos can be fined as much as a hundred thousand every time he shows up ' do you believe this shit, casino 
311,what the fuck is that supposed to mean, casino 
312,well it wasn't long before what i was afraid was gonna happen happened nicky managed to get himself banned from every casino in las vegas and from then on i couldn't be seen talkin' to him anywhere in vegas or even near it, casino 
313,all right, casino 
314,i'm just tellin' you don't say i didn't warn you, casino 
315,what am i doin' out here i'm tryin' to make a livin' that's all, casino 
316,bullshit or no bullshit they put you in that book you're gonna be in a lot of trouble you will not be able to walk into the casino i'm tellin' you, casino 
317,that black book is a bunch of bullshit they got two names in there for the whole country and one of them is still al capone, casino 
318,i'm i'm hearin' things from security they're all ex cops the sheriff's lookin' to bust your balls they want to put you in the black book, casino 
319,why somebody's complaining, casino 
320,you better watch yourself there's a lot of heat on you already, casino 
321,between, casino 
322,hey i gotta give the guy credit he does the most obvious thing this is the only town in the country where a bookie joint is legit so why not take advantage right so he took bookie joints off the street and then opened them up inside the casino well within a few years by doin' all of this he had every casino on the strip trying to copy off him, casino 
323,you're still eight pounds over what's the reason for this, casino 
324,but i'll tell you he knew how to bring in the crowds he knew all the fuckin' angles he brought over the whole 'femme fatale' show from paris but he forgot how lazy them european dancin' broads can get i mean he had to weigh 'em in once a week to make sure they didn't blow up like fuckin' balloons, casino 
325,thanks pal, casino 
326,okay, casino 
327,all right ace, casino 
328,i'm sorry about this really, casino 
329,if he does it again he's out for good i don't care what it is nick i'm gonna ha i'll i'll never let him in the place again, casino 
330,what ho hey come here, casino 
331,so what do you think i do i threw that cocksucker out, casino 
332,then he called me a faggot, casino 
333,what, casino 
334,and he tells me to go fuck myself, casino 
335,he insulted billy and then i walked over to him politely, casino 
336,no, casino 
337,no i didn't know that but you know what he did, casino 
338,you been lucky all week they're lookin' to nail ya, casino 
339,so i'm lucky i'm not allowed to get lucky in this place, casino 
