,lines,name
1153,int u s research laboratory corridor night, chill factor 
1154,you got thirty minutes, chill factor 
1155,video lock, chill factor 
1156,int tunnel day, chill factor 
1157,tight, chill factor 
1158,we're gonna seal that tunnel i want it air, chill factor 
1159,great all right, chill factor 
1160,int tunnel day, chill factor 
1161,major we've gotta seal that tunnel major, chill factor 
1162,int vitelli's helicopter day, chill factor 
1163,forty nine, chill factor 
1164,int vitelli's helicopter day, chill factor 
1165,no sign of 'em, chill factor 
1166,int postal van day, chill factor 
1167,now, chill factor 
1168,hit it, chill factor 
1169,negative negative, chill factor 
1170,is elvis out, chill factor 
1171,get ready to take it out, chill factor 
1172,that tunnel, chill factor 
1173,here's what i want you to do, chill factor 
1174,what's going on colonel, chill factor 
1175,, chill factor 
1176,all right let's move, chill factor 
1177,gomez you fight the battles you can win now we've been outmaneuvered here brynner's next move is gonna be to get elvis out of the country and sell him to the highest bidder to do that he has to have planned an exit point that's where we intercept him that's where we make our play now you and your men back off, chill factor 
1178,sir we can't just let him get away with this, chill factor 
1179,it's not over brynner, chill factor 
1180,he was major andrew bryn, chill factor 
1181,colonel sir who the hell is this guy, chill factor 
1182,after that re, chill factor 
1183,and where are you going, chill factor 
1184,, chill factor 
1185,the sooner you get up the lab the sooner you'll figure it out, chill factor 
1186,pappas that other guy was unloading ice cream into a freezer now what could he have to do with a military scientist huh, chill factor 
1187,missoula's reporting the refrigerator truck as a stolen vehicle i told you mason was walking shit, chill factor 
1188,it must've happened right after we left, chill factor 
1189,thanks, chill factor 
1190,all right enough look, chill factor 
1191,son, chill factor 
1192,that little geek is my, chill factor 
1193,it could be a cover i suppose, chill factor 
1194,mason no he's a soda jerk drifter a hamburger flipper, chill factor 
1195,run a check fbi interpol, chill factor 
1196,son, chill factor 
1197,a man named tim ma, chill factor 
1198,who's your suspect, chill factor 
1199,five, chill factor 
1200,one of our units is pursuing a suspect up the thirty, chill factor 
1201,well i've got dr long's body down at the coroner's office, chill factor 
1202,have you i d 'd the bodies, chill factor 
1203,colonel, chill factor 
1204,what the hell are you talkin' about, chill factor 
1205,i will tell you what i, chill factor 
1206,i don't suppose you'd like to tell me what this is all about, chill factor 
1207,uh huh, chill factor 
1208,deputy art lewis jerome county sheriff's department, chill factor 
1209,, chill factor 
1210,excellent, chill factor 
1211,time, chill factor 
1212,try this one out some, chill factor 
1213,hey doc might wanna, chill factor 
1214,, chill factor 
1215,there's nothin' goin' on out there doc except maybe the occasional fly fisherman, chill factor 
1216,couldn't sleep pumper is everything uh all right tonight, chill factor 
1217,morning doc awful early aren't ya, chill factor 
1218,let me have those, chill factor 
1219,that the prey can bite back, chill factor 
1220,and only then does our noble friend realize, chill factor 
1221,tryin' to remember somethin' somebody once told me about tyin' a fly, chill factor 
1222,yeah i just, chill factor 
1223,doctor, chill factor 
1224,m means mason, chill factor 
1225,the only one who understands what this me, chill factor 
1226,you're the only one i can trust, chill factor 
1227,everything will die mason, chill factor 
1228,and what if it does, chill factor 
1229,never let it reach fifty degre degrees, chill factor 
1230,cold cold how cold, chill factor 
1231,or it'll ignite, chill factor 
1232,the compound has to be kept cold, chill factor 
1233,no, chill factor 
1234,call an ambulance, chill factor 
1235,, chill factor 
1236,shit oh shit, chill factor 
1237,mason, chill factor 
1238,doc, chill factor 
1239,, chill factor 
1240,some people might, chill factor 
1241,fishin', chill factor 
1242,to a simple thing like, chill factor 
1243,some people might say you're readin' an awful lot in, chill factor 
1244,is death, chill factor 
1245,without caution, chill factor 
1246,and that power, chill factor 
1247,back, chill factor 
1248,forcing him to strike and only then does our noble friend realize that the prey can bite, chill factor 
1249,create a piece of bait that sends the fish's instincts into overdrive, chill factor 
1250,tie a fly, chill factor 
1251,turn the power of the hunter against him, chill factor 
1252,there's only one way you can do it mason, chill factor 
1253,how can we ever hope to win against the trout, chill factor 
1254,the master of his realm, chill factor 
1255,sensitivity without neurosis he's, chill factor 
1256,he's brains without ambition, chill factor 
1257,is a perfect hunter, chill factor 
1258,no that's not possible mason the trout, chill factor 
1259,like a fish, chill factor 
1260,and i'm good at this been doing it since i was a kid but you i don't know somehow you think, chill factor 
1261,but you pull twice as many fish out of the water as i do, chill factor 
1262,yeah ten months we've been fishin' this river together we use the same equipment more or less, chill factor 
1263,my secret, chill factor 
1264,been trying to figure out your secret, chill factor 
1265,, chill factor 
1266,what, chill factor 
1267,miles, chill factor 
1268,i got eight thousand yards radius is five, chill factor 
1269,dr long, chill factor 
1270,we don't have an hour we're already supposed to be shut down, chill factor 
1271,i don't know um he's working but there's a lot of data maybe another hour, chill factor 
1272,how much longer for the range and power projections, chill factor 
1273,well your prediction was on the nose, chill factor 
1274,so reaction temperature is fifty degrees, chill factor 
1275,well costello's finished with the stability profile but abbott is still chewing on the load file, chill factor 
1276,mr sweeney how goes it, chill factor 
1277,, chill factor 
1278,okay i'll have a chopper meet you at the top, chill factor 
1279,there's a vent shaft leading straight up, chill factor 
1280,yeah, chill factor 
1281,mason mason, chill factor 
1282,god they're gonna seal it, chill factor 
1283,tunnel, chill factor 
1284,if you're not out of there soon i have got to seal the, chill factor 
1285,forty seven, chill factor 
1286,mason what is the temperature of elvis, chill factor 
1287,i'm at mile marker, chill factor 
1288,mason, chill factor 
1289,where are you now, chill factor 
1290,we've got the real thing, chill factor 
1291,what we gave brynner on the dam was a phony, chill factor 
1292,son, chill factor 
1293,what say again ma, chill factor 
1294,yeah yeah, chill factor 
1295,you mason, chill factor 
1296,fol, chill factor 
1297,all right go, chill factor 
1298,yeah i'm sure, chill factor 
1299,you sure, chill factor 
1300,, chill factor 
1301,i'll lead 'em out, chill factor 
1302,all right, chill factor 
1303,jesus, chill factor 
1304,the army sealin' us in, chill factor 
1305,what the hell was that, chill factor 
1306,, chill factor 
1307,don't move, chill factor 
1308,just go check the temperature, chill factor 
1309,tunnel now, chill factor 
1310,we're all gonna die in this, chill factor 
1311,wait listen to me pappas if you don't let us by, chill factor 
1312,, chill factor 
1313,what happened to colonel brynner, chill factor 
1314,side, chill factor 
1315,his name's vitelli talk to him he's right out, chill factor 
1316,on the other end of this phone, chill factor 
1317,there's a colonel, chill factor 
1318,listen pappas, chill factor 
1319,now raise 'em, chill factor 
1320,, chill factor 
1321,stole a truck under arrest, chill factor 
1322,yeah asshole i'm puttin' a murder suspect and a guy who, chill factor 
1323,any idea what's goin' on here, chill factor 
1324,you redneck idiot do you have, chill factor 
1325,i said let me see your hands now, chill factor 
1326,pappas move the car, chill factor 
1327,hands, chill factor 
1328,let me see your, chill factor 
1329,then how about if i call you ass, chill factor 
1330,you know i gotta tell you that really bothers me somebody calls me son, chill factor 
1331,to talk son, chill factor 
1332,shut your mouth until i tell you, chill factor 
1333,beer, chill factor 
1334,i didn't sell the boy any, chill factor 
1335,public drunkenness, chill factor 
1336,mason you wouldn't know the truth if it bit you we've got your whole record we know about the the conviction for vagrancy, chill factor 
1337,lying, chill factor 
1338,that's not the way i, chill factor 
1339,seriously, chill factor 
1340,i don't sell beer to minors i take that kinda thing, chill factor 
1341,selling this young man beer wednesday night, chill factor 
1342,so you don't remember, chill factor 
1343,got that, chill factor 
1344,you answer mine, chill factor 
1345,badge someday then you can ask the questions until then, chill factor 
1346,you find yourself wearing a, chill factor 
1347,lem, chill factor 
1348,nope is there a prob, chill factor 
1349,do you recognize this young man, chill factor 
1350,if it was wednesday night i was workin', chill factor 
1351,uh drifting around like the trash you are or were you here workin', chill factor 
1352,so mason last wednesday night uh were you out, chill factor 
1353,black background, chill factor 
1354,oh, chill factor 
1355,int tunnel air vent day, chill factor 
1356,, chill factor 
1357,, chill factor 
1358,, chill factor 
1359,int andy's ice cream factory andy's office day, chill factor 
1360,arlo, chill factor 
1361,int brynner's van day, chill factor 
1362,talk to me, chill factor 
1363,damn phone, chill factor 
1364,gimme this god, chill factor 
1365,int ice cream truck cab day, chill factor 
1366,, chill factor 
1367,int ice cream truck box day, chill factor 
1368,, chill factor 
1369,, chill factor 
1370,, chill factor 
1371,, chill factor 
1372,ext ice cream truck day, chill factor 
1373,, chill factor 
1374,ext darlene's store night, chill factor 
1375,get in, chill factor 
1376,ext u s army research laboratory guard gate jerome night, chill factor 
1377,the usual doc, chill factor 
1378,okay doc, chill factor 
1379,int tunnel day, chill factor 
1380,now seal that tunnel now, chill factor 
1381,int tunnel day, chill factor 
1382,he must've had a damn arsenal in there, chill factor 
1383,there's ammo fire from brynner's vehicle, chill factor 
1384,int vitelli's helicopter day, chill factor 
1385,negative negative, chill factor 
1386,int gomez's helicopter day, chill factor 
1387,gotta seal it, chill factor 
1388,int tunnel day, chill factor 
1389,it's too late mason i've, chill factor 
1390,int postal van day, chill factor 
1391,i'll stay here and secure this position, chill factor 
1392,int vitelli's helicopter day, chill factor 
1393,uh so head for the other end of the tunnel, chill factor 
1394,int gomez's helicopter day, chill factor 
1395,do it now, chill factor 
1396,int gomez's helicopter day, chill factor 
1397,we've gotta take out brynner's van before they reach, chill factor 
0,sending what we know back to u s t via satellite, innerspace 
1,what are you doing, innerspace 
2,that's nice, innerspace 
3,in a way we're like brothers i can't have her i want you to, innerspace 
4,don't worry about me you take this time for your own you two, innerspace 
5,i'll get us out of here, innerspace 
6,don't worry i owe you a lot i'm not gonna let us rot here i'm gonna find us a way out, innerspace 
7,i mean it no one else would have helped i take it all back everything i've said about you, innerspace 
8,awwww, innerspace 
9,i want to thank you for what you've done, innerspace 
10,i want you to know how much i appreciate what you've done, innerspace 
11,i don't know how we're gonna get out of this but we will somehow, innerspace 
12,you're lovely, innerspace 
13,she's so lovely it's all my fault i was wrong, innerspace 
14,yeah sure, innerspace 
15,you're a lucky man, innerspace 
16,they can, innerspace 
17,she's in love with you anyone can see that, innerspace 
18,i know it's no good i've no right to be jealous, innerspace 
19,oh no, innerspace 
20,thing is i think i'm in love with her, innerspace 
21,not really truth is i was jealous of you, innerspace 
22,you've changed your mind, innerspace 
23,she is beautiful, innerspace 
24,no she just stayed with us like she did all along, innerspace 
25,i was wrong she tried to help us get away, innerspace 
26,you were the one who was always suspicious of her, innerspace 
27,now you're too suspicious, innerspace 
28,she works for them, innerspace 
29,rene, innerspace 
30,dieter asked where i was he expected me here maybe someone was assigned to bring me here, innerspace 
31,about what, innerspace 
32,i have been i think you're right, innerspace 
33,keep thinking, innerspace 
34,i can always flush you down the toilet, innerspace 
35,looks like you can have all you want, innerspace 
36,gimme a minute, innerspace 
37,we are in a dungeon how do we get out, innerspace 
38,never mind that where are we now, innerspace 
39,where've you been, innerspace 
40,be quiet, innerspace 
41,losing power the laser drained it, innerspace 
42,what happened, innerspace 
43,i don't know, innerspace 
44,what exactly, innerspace 
45,do something, innerspace 
46,ought to be they stole everything and reverse engineered it looks like all they need is the chip, innerspace 
47,pretty advanced isn't it, innerspace 
48,well don't let it what are you doing, innerspace 
49,this may hurt, innerspace 
50,and don't let her know either, innerspace 
51,there's a lot you don't know, innerspace 
52,gruner switched the chip to him not from him then he led us away again to chiang cho, innerspace 
53,dieter, innerspace 
54,the man we want has the pem and is across the border by now, innerspace 
55,he aready made the deal, innerspace 
56,shit it's just money, innerspace 
57,holy, innerspace 
58,aim what, innerspace 
59,aim just in front of his face, innerspace 
60,just fine i'll do the driving from now on, innerspace 
61,are you alright, innerspace 
62,don't worry i can, innerspace 
63,i can't handle that thing, innerspace 
64,do it, innerspace 
65,he didn't he left us that walkman chip to confuse us would have kept most people busy we were too fast for him, innerspace 
66,then why'd he lead us here, innerspace 
67,he must not know gruner just made the switch back, innerspace 
68,and dieter, innerspace 
69,it's in the watch he lead us on that chase while dieter brought the chip into hong kong, innerspace 
70,where, innerspace 
71,while he makes the run, innerspace 
72,he hung us up dry, innerspace 
73,it's not the one wait there's a label, innerspace 
74,well, innerspace 
75,left the one with the red dot, innerspace 
76,cash, innerspace 
77,haka xuki what's that mean, innerspace 
78,haka xuki, innerspace 
79,you said 100 000 yen for the right sony walkman, innerspace 
80,what was it what'd i say, innerspace 
81,just say the words just like i told you, innerspace 
82,well at least talk it up then i feel like an idiot, innerspace 
83,not sure at all, innerspace 
84,you sure this will work, innerspace 
85,i was afraid of that, innerspace 
86,i've got an idea, innerspace 
87,plenty of circuits in a walkman, innerspace 
88,come on, innerspace 
89,it's him, innerspace 
90,then why let her out of our sight besides she's all we've got, innerspace 
91,i don't trust her, innerspace 
92,probably, innerspace 
93,hiroshima she's going with us are you out of your mind, innerspace 
94,no you can't trust her, innerspace 
95,i need a guide and you need a client and 1000, innerspace 
96,you were with gruner, innerspace 
97,he was with gruner, innerspace 
98,, innerspace 
99,never mind just say it, innerspace 
100,what, innerspace 
101,neither can they, innerspace 
102,i can't see a thing, innerspace 
103,door to the right get up and run, innerspace 
104,a hard left a hard left, innerspace 
105,ow, innerspace 
106,trying to analyze this stuff now go to the medicine shelf and take and, innerspace 
107,what are you doing, innerspace 
108,imagine a better grape for the region, innerspace 
109,you have to quickly, innerspace 
110,i can't, innerspace 
111,drink lots of water, innerspace 
112,what next, innerspace 
113,too late, innerspace 
114,drink it, innerspace 
115,don't worry, innerspace 
116,don't touch a thing, innerspace 
117,i know she's not with them i know something else what's bothering you isn't her, innerspace 
118,one of your instincts, innerspace 
119,i told you i have a feeling, innerspace 
120,yeah you've fallen for her, innerspace 
121,you think that's what you're good at, innerspace 
122,what are you doing wait a minute lets think this through, innerspace 
123,it is a blank this is no time for zen, innerspace 
124,relax make your mind a blank, innerspace 
125,relax let me do this, innerspace 
126,what do i do, innerspace 
127,joe i'm here you're okay, innerspace 
128,wait a minute wait a minute al you leave my heart alone, innerspace 
129,down to your heart i'm gonna clean some fat out before you drop on me, innerspace 
130,where are you going, innerspace 
131,just stay here and rest, innerspace 
132,sapporo, innerspace 
133,that's not funny, innerspace 
134,beer and cakes cookies anything bad, innerspace 
135,i can't keep up, innerspace 
136,come on she's getting away, innerspace 
137,run stupid, innerspace 
138,on what, innerspace 
139,follow her, innerspace 
140,what do i do, innerspace 
141,i'm running in circles in the middle of some foreign country i don't speak their language they don't speak mine i don't even know where i am what's going to present itse, innerspace 
142,we are trying to stand out right near his address easier to get them to come to us than to try and find them now keep your eyes open something might present itself, innerspace 
143,don't you think i stand out like this, innerspace 
144,fountainhead of high tech, innerspace 
145,osaka, innerspace 
146,osaka, innerspace 
147,that's good it's not better where, innerspace 
148,better i found ryuji, innerspace 
149,you found her, innerspace 
150,bingo, innerspace 
151,why don't you get out of my face, innerspace 
152,some agent you are, innerspace 
153,it wasn't like that, innerspace 
154,you been had we have, innerspace 
155,i i'll got to the movies that's what i'll do, innerspace 
156,no what will you do, innerspace 
157,no what do you hope al i hope i just hope that someday you're real small and you've got no time and you got no one to help you and you depend on me and you know what i'll do, innerspace 
158,you get time off to sleep, innerspace 
159,it's not your time i get time off, innerspace 
160,and on my time, innerspace 
161,shit you're in love, innerspace 
162,she's got the most beautiful s, innerspace 
163,oh you were right they've all been here before met just last week, innerspace 
164,is that all, innerspace 
165,ahhh works ryuji travel just business she's fine arts university of tokyo, innerspace 
166,what she say what'd you get out of her, innerspace 
167,i don't know, innerspace 
168,what happened, innerspace 
169,i mean it you watch old tapes of the ballgame i'll fill you in later i mean it, innerspace 
170,joe it's 56 hours, innerspace 
171,you shut down your sensors, innerspace 
172,oh come on, innerspace 
173,you got any books in there, innerspace 
174,what am i supposed to do, innerspace 
175,i'll be right here i'll keep it in mind i'll get a lot more from her without you butting in, innerspace 
176,what if she says something important, innerspace 
177,it's embarrassing, innerspace 
178,you can't listen you can't watch either, innerspace 
179,what is it, innerspace 
180,not her you, innerspace 
181,you're doing great with her, innerspace 
182,this just won't work, innerspace 
183,what is it your charm, innerspace 
184,come on look at her don't you know anything about women the data is skewed we might as well go with instinct, innerspace 
185,can't tell every time i try her you look away or you make noises maybe you don't want to know, innerspace 
186,maybe she's telling the truth, innerspace 
187,she's the toughest to read, innerspace 
188,even rene, innerspace 
189,your data must be bad everyone can't be lying all the time, innerspace 
190,voice stress analyzer, innerspace 
191,how do you know, innerspace 
192,they're all in it, innerspace 
193,i've lost something i must get it back, innerspace 
194,joe be careful, innerspace 
195,don't get too cute, innerspace 
196,my coast is maine actually we have a place in bar harbor and a bar in sutton place, innerspace 
197,he recognises you throw him off, innerspace 
198,it lends you an air of mystery, innerspace 
199,i don't know what's going on, innerspace 
200,just don't show fear, innerspace 
201,killer, innerspace 
202,the blond gruner a killer, innerspace 
203,which one, innerspace 
204,just hold them close and stay still, innerspace 
205,i feel like an idiot, innerspace 
206,are you serious, innerspace 
207,follow that busboy, innerspace 
208,the drinks stay on them, innerspace 
209,what glasses, innerspace 
210,who are they stay on them will you how can we find out wait the glasses, innerspace 
211,that's a big if, innerspace 
212,pan the group will you if you're right at least one of them is involved, innerspace 
213,you got a better idea you tell me other than her there's no one here i know, innerspace 
214,who me, innerspace 
215,you're not just after this girl are you, innerspace 
216,that place by the window, innerspace 
217,get close to them, innerspace 
218,you have no taste, innerspace 
219,they both look good to me, innerspace 
220,the beautiful one, innerspace 
221,which one is she, innerspace 
222,doesn't, innerspace 
223,you want sophistication it don't come cheap, innerspace 
224,what did that cost, innerspace 
225,why not, innerspace 
226,not that tie with that coat, innerspace 
227,but the rest is me i'll dress like i want, innerspace 
228,it is my business it's my name, innerspace 
229,mind your own business, innerspace 
230,not blue enough, innerspace 
231,much too blue, innerspace 
232,this is not going to work out, innerspace 
233,you really like that shirt, innerspace 
234,looks like the optic nerve i can see out, innerspace 
235,what is it, innerspace 
236,is something glinting, innerspace 
237,what's nothing look like it looks like nothing, innerspace 
238,but what's it look like, innerspace 
239,what are you looking at, innerspace 
240,now where would i be, innerspace 
241,but you've got to have sophistication savoir faire, innerspace 
242,yeah i did it, innerspace 
243,well you did it today, innerspace 
244,i'm not some hot shot test pilot i'm not some playboy i don't usually pick up girls, innerspace 
245,rene, innerspace 
246,you stumbled around remember you've got my id you've got to be me not some stumblebum, innerspace 
247,i made it work, innerspace 
248,it worked, innerspace 
249,yeah some help that poetry really killed her, innerspace 
250,good thing i'm here to do the thinking, innerspace 
251,maybe they won't stand on ceremony, innerspace 
252,without your pants, innerspace 
253,to the hotel to register, innerspace 
254,where are you going, innerspace 
255,rene, innerspace 
256,what happened, innerspace 
257,no you idiot, innerspace 
258,joe, innerspace 
259,touch some part of her body trust me it works, innerspace 
260,what, innerspace 
261,touch her, innerspace 
262,where are you staying, innerspace 
263,where is she staying, innerspace 
264,wait, innerspace 
265,wait, innerspace 
266,, innerspace 
267,, innerspace 
268,anything aw hell just tell her the truth, innerspace 
269,what, innerspace 
270,don't just stand there say something, innerspace 
271,what do i do, innerspace 
272,what can i do you're on your own, innerspace 
273,help me out will you, innerspace 
274,how should i know, innerspace 
275,which language, innerspace 
276,try another language, innerspace 
277,she doesn't seem to understand, innerspace 
278,what's happening, innerspace 
279,you're beautiful, innerspace 
280,she's beautiful what do i do, innerspace 
281,what is it, innerspace 
282,you're out of shape, innerspace 
283,she's pretty fast, innerspace 
284,follow it, innerspace 
285,this must be business there's nothing else here, innerspace 
286,a girl, innerspace 
287,what was, innerspace 
288,beautiful, innerspace 
289,are you screwing with any nerves, innerspace 
290,what what do you mean, innerspace 
291,al are you doing anything in there, innerspace 
292,where are you going wait, innerspace 
293,now lie down somewhere quiet and rest i'll be back in a while, innerspace 
294,for chrissakes it's only sand you should see some of the stuff that's floating around in here that sand's the cleanest thing in you including me now eat it, innerspace 
295,it's sand, innerspace 
296,why not, innerspace 
297,i don't want to eat it, innerspace 
298,eat it, innerspace 
299,eat it, innerspace 
300,the sand, innerspace 
301,now what, innerspace 
